{
  "id": "F06",
  "name": "Letter Spacing Reveal",
  "category": "title",
  "tier": "free",
  "style": [
    "cinematic"
  ],
  "description": "Tracking eases from wide to normal. Film-style short openings; avoid on small text.",
  "use": [
    "intro"
  ],
  "duration": {
    "enter": 1.3,
    "hold": 2.5,
    "exit": 0.6
  },
  "parameters": {
    "trackingFrom": 0.45,
    "trackingTo": 0.04,
    "easing": "easeOutQuart",
    "fontSize": 0.08
  },
  "constraints": {
    "minDuration": 2.0,
    "maxDuration": 6.0,
    "safeArea": true,
    "minFontPx": 40
  },
  "fallback": "simple_fade",
  "renderEngine": "remotion",
  "fallbackEngine": "ffmpeg",
  "supportsPreview": true,
  "composition": "LetterSpacingReveal",
  "license": {
    "code": "Apache-2.0",
    "assets": "bundled fonts: system / OFL only"
  },
  "preview": "assets/effects/F06.gif"
}
