{
  "id": "T02",
  "name": "Phrase Build",
  "category": "title",
  "tier": "pro",
  "style": [
    "social",
    "minimal"
  ],
  "description": "Phrase Build — Lionstone Pro typography.",
  "use": [
    "keypoint"
  ],
  "duration": {
    "enter": 0.5,
    "hold": 3.0,
    "exit": 0.5
  },
  "parameters": {},
  "constraints": {
    "minDuration": 1.2,
    "maxDuration": 20,
    "safeArea": true,
    "minFontPx": 20
  },
  "renderEngine": "ffmpeg",
  "fallbackEngine": "ffmpeg",
  "composition": "",
  "supportsPreview": true,
  "fallback": "F01",
  "preview": "",
  "license": {
    "code": "Lionstone Pro EULA",
    "assets": "no bundled assets"
  }
}
