{
  "id": "F02",
  "name": "Slow Rise",
  "category": "title",
  "tier": "free",
  "style": [
    "cinematic",
    "minimal",
    "documentary"
  ],
  "description": "Title rises gently from below and settles. Courses and documentary chapters.",
  "use": [
    "chapter",
    "intro"
  ],
  "duration": {
    "enter": 0.85,
    "hold": 3.0,
    "exit": 0.5
  },
  "parameters": {
    "distance": 0.03,
    "easing": "easeOutCubic",
    "fontSize": 0.07
  },
  "constraints": {
    "minDuration": 1.5,
    "maxDuration": 8.0,
    "safeArea": true,
    "minFontPx": 28
  },
  "fallback": "simple_fade",
  "renderEngine": "remotion",
  "fallbackEngine": "ffmpeg",
  "supportsPreview": true,
  "composition": "SlowRise",
  "license": {
    "code": "Apache-2.0",
    "assets": "bundled fonts: system / OFL only"
  },
  "preview": "assets/effects/F02.gif"
}
